<?xml version="1.0" encoding="UTF-8"?>
<!-- 
 * Copyright 2008 Philippe Prados.
 *
 * Licensed under the Apache License, Version 2.0 (the "License");
 * you may not use this file except in compliance with the License.
 * You may obtain a copy of the License at
 *
 *      http://www.apache.org/licenses/LICENSE-2.0
 *
 * Unless required by applicable law or agreed to in writing, software
 * distributed under the License is distributed on an "AS IS" BASIS,
 * WITHOUT WARRANTIES OR CONDITIONS OF ANY KIND, either express or implied.
 * See the License for the specific language governing permissions and
 * limitations under the License.
 *
-->
<resources 
	xmlns="http://jndi-resources.googlecode.com/1.0/"
	xmlns:xsi="http://www.w3.org/2001/XMLSchema-instance"
	xsi:schemaLocation="http://jndi-resources.googlecode.com/1.0/ http://www.prados.fr/xsd/1.0/jndi-resources.xsd"
	id="ear-sample"
>
	<!-- *** WAR resources *** -->
	<resource name="web-sample/jdbc/Default" familly="jdbc/default" />
	
	<resource name="web-sample/mail/Default" familly="mail/default" >
		<property name="store.protocol" value="imap"/>
		<property name="transport.protocol" value="smtp"/>
		<property name="transport.user" value="smtp@user.org"/>
	</resource>

	<resource name="web-sample/mail/email" familly="mail/email">
 		<property name="email" value="${mon.e-mail}"/>
	</resource>

	<resource name="web-sample/url/Default" familly="url/default">
 		<property name="url" value="${url.default}"/>
	</resource>

	<resource name="web-sample/host/Default" familly="host/default">
 		<property name="host" value="${host.default}"/>
	</resource>

	<resource name="web-sample/ejb/LookupJndi" familly="link/default">
 		<property name="link" value="ejb-sample/ejb/LookupJndi"/>
	</resource>

	<!-- *** EJB resources (link to WAR resources) *** -->
	<resource name="ejb-sample/jdbc/Default" familly="link/default">
 		<property name="link" value="java:web-sample/jdbc/Default"/>
	</resource>

	<resource name="ejb-sample/url/Default" familly="link/default">
 		<property name="link" value="java:web-sample/url/Default"/>
	</resource>

	<resource name="ejb-sample/host/Default" familly="link/default">
 		<property name="link" value="java:web-sample/host/Default"/>
	</resource>

</resources>